{
  "version": "1.0.0",
  "chapter": 2,
  "topic": "Sorting and Searching",
  "challenges": [
    {
      "id": "ch2-easy-001",
      "difficulty": "easy",
      "mode": "identify-from-visual",
      "prompt": "Observe the visualization and pick the correct algorithm.",
      "algorithmKey": "bubble-sort",
      "tags": ["visual", "recognition"],
      "visualization": {
        "demoKey": "BubbleSort",
        "snapshotRef": "frame_12"
      },
      "choices": [
        { "id": "opt-a", "label": "Bubble Sort", "displayKey": "A" },
        { "id": "opt-b", "label": "Selection Sort", "displayKey": "B" },
        { "id": "opt-c", "label": "Insertion Sort", "displayKey": "C" }
      ],
      "correctChoiceId": "opt-a",
      "scoring": {
        "basePoints": 100,
        "wrongPenalty": 20
      }
    },
    {
      "id": "ch2-medium-001",
      "difficulty": "medium",
      "mode": "perform-by-steps",
      "prompt": "Perform the next correct steps of Insertion Sort on the current array.",
      "algorithmKey": "insertion-sort",
      "algorithmLabel": "Insertion Sort",
      "tags": ["interactive", "step-execution"],
      "initialState": {
        "array": [5, 2, 4, 6, 1, 3],
        "currentIndex": 1
      },
      "expectedSteps": [
        {
          "step": 1,
          "action": "insert",
          "payload": { "from": 1, "to": 0 },
          "stateAfter": { "array": [2, 5, 4, 6, 1, 3], "currentIndex": 2 }
        },
        {
          "step": 2,
          "action": "insert",
          "payload": { "from": 2, "to": 1 },
          "stateAfter": { "array": [2, 4, 5, 6, 1, 3], "currentIndex": 3 }
        }
      ],
      "rollbackPolicy": {
        "type": "keep-n-minus-1",
        "keepCompletedSteps": true,
        "maxMistakes": 3
      },
      "scoring": {
        "basePoints": 120,
        "wrongPenalty": 10
      }
    },
    {
      "id": "ch2-hard-001",
      "difficulty": "hard",
      "mode": "complete-missing-function",
      "hardVariant": "function-only-4",
      "prompt": "Choose the correct function to complete the code and match the target visualization.",
      "algorithmKey": "binary-search",
      "tags": ["code-completion", "function-selection"],
      "codeTemplate": "function solve(arr, target) {\n  // missing function call here\n  return MISSING_FN(arr, target);\n}",
      "missingFunctionName": "MISSING_FN",
      "visualizationTarget": {
        "demoKey": "BinarySearch",
        "expectedBehavior": "Search space halves each step and returns index if found."
      },
      "options": [
        {
          "id": "fn-a",
          "actualAlgorithm": "binary-search",
          "functionCode": "function MISSING_FN(arr, target){ let l=0,r=arr.length-1; while(l<=r){ const m=Math.floor((l+r)/2); if(arr[m]===target) return m; if(arr[m]<target) l=m+1; else r=m-1;} return -1; }"
        },
        {
          "id": "fn-b",
          "actualAlgorithm": "linear-search",
          "functionCode": "function MISSING_FN(arr, target){ for(let i=0;i<arr.length;i++){ if(arr[i]===target) return i; } return -1; }"
        },
        {
          "id": "fn-c",
          "actualAlgorithm": "jump-search",
          "functionCode": "function MISSING_FN(arr, target){ const n=arr.length; const step=Math.floor(Math.sqrt(n)); let prev=0; while(arr[Math.min(step,n)-1] < target){ prev=step; if(prev>=n) return -1; } for(let i=prev;i<Math.min(step,n);i++){ if(arr[i]===target) return i; } return -1; }"
        },
        {
          "id": "fn-d",
          "actualAlgorithm": "interpolation-search",
          "functionCode": "function MISSING_FN(arr, target){ let lo=0, hi=arr.length-1; while(lo<=hi && target>=arr[lo] && target<=arr[hi]){ if(lo===hi) return arr[lo]===target?lo:-1; const pos=lo + Math.floor(((target-arr[lo])*(hi-lo))/(arr[hi]-arr[lo])); if(arr[pos]===target) return pos; if(arr[pos]<target) lo=pos+1; else hi=pos-1; } return -1; }"
        }
      ],
      "correctOptionId": "fn-a",
      "scoring": {
        "basePoints": 200,
        "wrongPenalty": 40,
        "firstTryBonus": 30
      }
    },
    {
      "id": "ch2-hard-002",
      "difficulty": "hard",
      "mode": "complete-missing-function",
      "hardVariant": "mixed-labels-4",
      "prompt": "Pick the correct function from 4 options. Labels can be misleading.",
      "algorithmKey": "merge-sort",
      "tags": ["code-completion", "label-trap"],
      "codeTemplate": "function solve(arr) {\n  return MISSING_FN(arr);\n}",
      "missingFunctionName": "MISSING_FN",
      "visualizationTarget": {
        "demoKey": "MergeSort",
        "expectedBehavior": "Recursively split and merge sorted halves."
      },
      "options": [
        {
          "id": "fn-a",
          "actualAlgorithm": "merge-sort",
          "displayedAlgorithmLabel": "Merge Sort",
          "functionCode": "function MISSING_FN(arr){ if(arr.length<=1) return arr; const mid=Math.floor(arr.length/2); const left=MISSING_FN(arr.slice(0,mid)); const right=MISSING_FN(arr.slice(mid)); const out=[]; let i=0,j=0; while(i<left.length&&j<right.length){ out.push(left[i]<=right[j]?left[i++]:right[j++]); } return out.concat(left.slice(i)).concat(right.slice(j)); }"
        },
        {
          "id": "fn-b",
          "actualAlgorithm": "quick-sort",
          "displayedAlgorithmLabel": "Merge Sort",
          "functionCode": "function MISSING_FN(arr){ if(arr.length<=1) return arr; const p=arr[arr.length-1]; const l=[],r=[]; for(let i=0;i<arr.length-1;i++){ if(arr[i]<p) l.push(arr[i]); else r.push(arr[i]); } return [...MISSING_FN(l),p,...MISSING_FN(r)]; }"
        },
        {
          "id": "fn-c",
          "actualAlgorithm": "heap-sort",
          "displayedAlgorithmLabel": "Counting Sort",
          "functionCode": "function MISSING_FN(arr){ const a=[...arr]; a.sort((x,y)=>x-y); return a; }"
        },
        {
          "id": "fn-d",
          "actualAlgorithm": "counting-sort",
          "displayedAlgorithmLabel": "Heap Sort",
          "functionCode": "function MISSING_FN(arr){ if(arr.length===0) return []; const max=Math.max(...arr); const cnt=new Array(max+1).fill(0); for(const x of arr) cnt[x]++; const out=[]; for(let i=0;i<cnt.length;i++){ while(cnt[i]-->0) out.push(i); } return out; }"
        }
      ],
      "correctOptionId": "fn-a",
      "labelRules": {
        "truthfulLabeledOptionIds": ["fn-a"],
        "misleadingLabeledOptionIds": ["fn-b", "fn-c", "fn-d"],
        "swappedLabelPair": ["fn-c", "fn-d"]
      },
      "scoring": {
        "basePoints": 220,
        "wrongPenalty": 40,
        "firstTryBonus": 40
      }
    }
  ]
}
